I want to have,cart_add
Could i have,cart_add
Can I have,cart_add
Could you please add,cart_add
I want to add,cart_add
I would like to have,cart_add
I'd like to have,cart_add
One please,cart_add
Can you please add,cart_add
I don't want to have,cart_delete
Can I remove,cart_delete
Can you please remove,cart_delete
Could i remove,cart_delete
Could you please remove,cart_delete
I want to remove,cart_delete
I would like to remove,cart_delete
I'd like to remove,cart_delete
Remove,cart_delete
Can I delete,cart_delete
Can you please delete,cart_delete
Could i delete,cart_delete
Could you please delete,cart_delete
I want to delete,cart_delete
I would like to delete,cart_delete
I'd like to delete,cart_delete
Delete,cart_delete
What have I added?,cart_list
Could you list my items?,cart_list
Could you list my cart?,cart_list
What have I ordered?,cart_list
Please list my order,cart_list
What's in my order?,cart_list
What's in my cart?,cart_list
Could you list my order?,cart_list
Please list my cart,cart_list
What have I ordered?,cart_list
Could you please list my items?,cart_list
Could you please list my cart?,cart_list
Could you please list my order?,cart_list
What do you have in,item_list
What's available in,item_list
Could you recommend ,item_list
Could you recommend something in,item_list
Do you have,item_list
Do you serve,item_list
Do you prepare,item_list
Is available,item_list
